{
 "refId": "flange-bolting",
 "version": "2.1.0",
 "source": "ASME B16.5-2025, the 'Templates for Drilling' tables 7, 10, 13, 15, 17, 19 and 21 (SI units), transcribed from a purchased copy. The document itself is NOT in this repository; see standards-source/README.md.",
 "note": "What ONE flanged joint needs. This pack exists to answer a single question: has enough bolting been taken off? The user's rule is that bolting is ordered in its own right, with an allowance over the calculated need, so nothing here derives an MTO line. It only supplies the floor that a take-off must clear. Bolt count and diameter are fixed by B16.5 and are safe to assert. LENGTH IS NOT: it depends on facing, gasket thickness and whether the joint is a stud or a machine bolt, so minLengthMm is the shortest credible raised-face stud with a spiral wound gasket and is marked unverified. A take-off shorter than that is wrong; one longer than it is a judgement this system does not second-guess.\n\nTHE TABLES USE TWO DIFFERENT COLUMN LAYOUTS. At Class 150 and 300 the last three columns are stud Raised Face, stud Ring Joint, and MACHINE BOLT Raised Face. From Class 400 up there is no machine bolt at all and the three columns are stud Raised Face, stud Male-and-Female / Tongue-and-Groove, and stud Ring Joint. Reading one layout with the other's column names silently files ring-joint lengths as machine-bolt lengths.",
 "units": {
  "boltDiameter": "in",
  "length": "mm",
  "size": "NPS in"
 },
 "conventions": {
  "twoNutsPerStud": "A stud bolt takes two nuts, one each end. A machine bolt takes one. nutsPerBolt is carried per joint because the ratio is a property of the fastener style, not of the flange.",
  "oneJointTwoFlanges": "A flanged joint is TWO flanges and ONE set of bolts. A take-off that counts a bolt set per flange doubles the order. The reconciler therefore works in joints, and how flange count becomes joint count is the caller's problem - it is stated, never guessed.",
  "lengthUnverified": "Every minLengthMm carries verified:false for the reason in the note. Do not quote one to a vendor.",
  "studVersusMachineBolt": "A stud bolt is a headless threaded rod with a nut at EACH end; a machine bolt has an integral hex head and takes ONE nut. That is why nutsPerBolt is not a free parameter - it follows from the fastener style, and the caller states the style rather than the ratio. B16.5 permits machine bolts only at Class 150 and Class 300, with raised or flat face; from Class 600 upward, and for any ring joint face, the joint must be studded. minLengthMachineBoltMm is therefore ABSENT above 300# - absent meaning not permitted, not unknown.",
  "boltLengthIsMeasuredDifferently": "A stud bolt length is measured first thread to last thread, EXCLUDING the end chamfers (the B18.31.2 'LEP' convention); a machine bolt is measured from UNDER THE HEAD. The two numbers are not comparable, which is why they are separate columns rather than one figure with a tolerance. A vendor quoting overall length including the points is roughly two thread pitches longer than the order, and that argument surfaces at incoming inspection.",
  "seriesIsDimensionalOnly": "Series A and B differ in bolt count, bolt diameter and bolt circle, so the series axis is REQUIRED here. It is deliberately absent from flange-pt-ratings, because the two series share identical pressure-temperature ratings. ADR-008 section 11.15.",
  "absenceIsNotSufficiency": "A size with no row is UNKNOWN, not adequate. Before this pack declared its coverage, a lookup above NPS 24 returned null and every caller read it as nothing to check. ADR-008 section 11.14."
 },
 "ratings": [
  {
   "rating": "150#",
   "standard": "B16.5",
   "series": null,
   "bolting": [
    {
     "nps": "1/2",
     "verified": true,
     "source": "ASME B16.5-2025 Table 7",
     "readOn": "2026-09-24",
     "boltCount": 4,
     "boltDiameterIn": "1/2",
     "boltHoleDiameterIn": "5/8",
     "flangeOdMm": 89,
     "boltCircleMm": 60.5,
     "minLengthMm": 55,
     "minLengthMachineBoltMm": 50
    },
    {
     "nps": "3/4",
     "verified": true,
     "source": "ASME B16.5-2025 Table 7",
     "readOn": "2026-09-24",
     "boltCount": 4,
     "boltDiameterIn": "1/2",
     "boltHoleDiameterIn": "5/8",
     "flangeOdMm": 99,
     "boltCircleMm": 69.8,
     "minLengthMm": 65,
     "minLengthMachineBoltMm": 50
    },
    {
     "nps": "1",
     "verified": true,
     "source": "ASME B16.5-2025 Table 7",
     "readOn": "2026-09-24",
     "boltCount": 4,
     "boltDiameterIn": "1/2",
     "boltHoleDiameterIn": "5/8",
     "flangeOdMm": 108,
     "boltCircleMm": 79.2,
     "minLengthMm": 65,
     "minLengthRingJointMm": 75,
     "minLengthMachineBoltMm": 55
    },
    {
     "nps": "1 1/4",
     "verified": true,
     "source": "ASME B16.5-2025 Table 7",
     "readOn": "2026-09-24",
     "boltCount": 4,
     "boltDiameterIn": "1/2",
     "boltHoleDiameterIn": "5/8",
     "flangeOdMm": 117,
     "boltCircleMm": 88.9,
     "minLengthMm": 70,
     "minLengthRingJointMm": 85,
     "minLengthMachineBoltMm": 55
    },
    {
     "nps": "1 1/2",
     "verified": true,
     "source": "ASME B16.5-2025 Table 7",
     "readOn": "2026-09-24",
     "boltCount": 4,
     "boltDiameterIn": "1/2",
     "boltHoleDiameterIn": "5/8",
     "flangeOdMm": 127,
     "boltCircleMm": 98.6,
     "minLengthMm": 70,
     "minLengthRingJointMm": 85,
     "minLengthMachineBoltMm": 65
    },
    {
     "nps": "2",
     "verified": true,
     "source": "ASME B16.5-2025 Table 7",
     "readOn": "2026-09-24",
     "boltCount": 4,
     "boltDiameterIn": "5/8",
     "boltHoleDiameterIn": "3/4",
     "flangeOdMm": 152,
     "boltCircleMm": 120.6,
     "minLengthMm": 85,
     "minLengthRingJointMm": 95,
     "minLengthMachineBoltMm": 70
    },
    {
     "nps": "2 1/2",
     "verified": true,
     "source": "ASME B16.5-2025 Table 7",
     "readOn": "2026-09-24",
     "boltCount": 4,
     "boltDiameterIn": "5/8",
     "boltHoleDiameterIn": "3/4",
     "flangeOdMm": 178,
     "boltCircleMm": 139.7,
     "minLengthMm": 90,
     "minLengthRingJointMm": 100,
     "minLengthMachineBoltMm": 75
    },
    {
     "nps": "3",
     "verified": true,
     "source": "ASME B16.5-2025 Table 7",
     "readOn": "2026-09-24",
     "boltCount": 4,
     "boltDiameterIn": "5/8",
     "boltHoleDiameterIn": "3/4",
     "flangeOdMm": 190,
     "boltCircleMm": 152.4,
     "minLengthMm": 90,
     "minLengthRingJointMm": 100,
     "minLengthMachineBoltMm": 75
    },
    {
     "nps": "3 1/2",
     "verified": true,
     "source": "ASME B16.5-2025 Table 7",
     "readOn": "2026-09-24",
     "boltCount": 8,
     "boltDiameterIn": "5/8",
     "boltHoleDiameterIn": "3/4",
     "flangeOdMm": 216,
     "boltCircleMm": 177.8,
     "minLengthMm": 90,
     "minLengthRingJointMm": 100,
     "minLengthMachineBoltMm": 75
    },
    {
     "nps": "4",
     "verified": true,
     "source": "ASME B16.5-2025 Table 7",
     "readOn": "2026-09-24",
     "boltCount": 8,
     "boltDiameterIn": "5/8",
     "boltHoleDiameterIn": "3/4",
     "flangeOdMm": 229,
     "boltCircleMm": 190.5,
     "minLengthMm": 90,
     "minLengthRingJointMm": 100,
     "minLengthMachineBoltMm": 75
    },
    {
     "nps": "5",
     "verified": true,
     "source": "ASME B16.5-2025 Table 7",
     "readOn": "2026-09-24",
     "boltCount": 8,
     "boltDiameterIn": "3/4",
     "boltHoleDiameterIn": "7/8",
     "flangeOdMm": 254,
     "boltCircleMm": 215.9,
     "minLengthMm": 95,
     "minLengthRingJointMm": 110,
     "minLengthMachineBoltMm": 85
    },
    {
     "nps": "6",
     "verified": true,
     "source": "ASME B16.5-2025 Table 7",
     "readOn": "2026-09-24",
     "boltCount": 8,
     "boltDiameterIn": "3/4",
     "boltHoleDiameterIn": "7/8",
     "flangeOdMm": 279,
     "boltCircleMm": 241.3,
     "minLengthMm": 100,
     "minLengthRingJointMm": 115,
     "minLengthMachineBoltMm": 85
    },
    {
     "nps": "8",
     "verified": true,
     "source": "ASME B16.5-2025 Table 7",
     "readOn": "2026-09-24",
     "boltCount": 8,
     "boltDiameterIn": "3/4",
     "boltHoleDiameterIn": "7/8",
     "flangeOdMm": 343,
     "boltCircleMm": 298.4,
     "minLengthMm": 110,
     "minLengthRingJointMm": 120,
     "minLengthMachineBoltMm": 90
    },
    {
     "nps": "10",
     "verified": true,
     "source": "ASME B16.5-2025 Table 7",
     "readOn": "2026-09-24",
     "boltCount": 12,
     "boltDiameterIn": "7/8",
     "boltHoleDiameterIn": "1",
     "flangeOdMm": 406,
     "boltCircleMm": 362.0,
     "minLengthMm": 115,
     "minLengthRingJointMm": 125,
     "minLengthMachineBoltMm": 100
    },
    {
     "nps": "12",
     "verified": true,
     "source": "ASME B16.5-2025 Table 7",
     "readOn": "2026-09-24",
     "boltCount": 12,
     "boltDiameterIn": "7/8",
     "boltHoleDiameterIn": "1",
     "flangeOdMm": 483,
     "boltCircleMm": 431.8,
     "minLengthMm": 120,
     "minLengthRingJointMm": 135,
     "minLengthMachineBoltMm": 100
    },
    {
     "nps": "14",
     "verified": true,
     "source": "ASME B16.5-2025 Table 7",
     "readOn": "2026-09-24",
     "boltCount": 12,
     "boltDiameterIn": "1",
     "boltHoleDiameterIn": "1 1/8",
     "flangeOdMm": 533,
     "boltCircleMm": 476.2,
     "minLengthMm": 135,
     "minLengthRingJointMm": 145,
     "minLengthMachineBoltMm": 115
    },
    {
     "nps": "16",
     "verified": true,
     "source": "ASME B16.5-2025 Table 7",
     "readOn": "2026-09-24",
     "boltCount": 16,
     "boltDiameterIn": "1",
     "boltHoleDiameterIn": "1 1/8",
     "flangeOdMm": 597,
     "boltCircleMm": 539.8,
     "minLengthMm": 135,
     "minLengthRingJointMm": 145,
     "minLengthMachineBoltMm": 115
    },
    {
     "nps": "18",
     "verified": true,
     "source": "ASME B16.5-2025 Table 7",
     "readOn": "2026-09-24",
     "boltCount": 16,
     "boltDiameterIn": "1 1/8",
     "boltHoleDiameterIn": "1 1/4",
     "flangeOdMm": 635,
     "boltCircleMm": 577.8,
     "minLengthMm": 145,